{
  "$schema": "https://json-schema.org/draft/2020-12/schema",
  "$id": "https://calm.finos.org/draft/2026-03/meta/core.json",
  "title": "Common Architecture Language Model (CALM) Vocab",
  "type": "object",
  "properties": {
    "nodes": {
      "type": "array",
      "items": {
        "$ref": "#/defs/node"
      }
    },
    "relationships": {
      "type": "array",
      "items": {
        "$ref": "#/defs/relationship"
      }
    },
    "metadata": {
      "$ref": "#/defs/metadata"
    },
    "controls": {
      "$ref": "control.json#/defs/controls"
    },
    "flows": {
      "type": "array",
      "items": {
        "$ref": "flow.json#/defs/flow"
      }
    },
    "adrs": {
      "type": "array",
      "items": {
        "anyOf": [
          {
            "type": "string"
          },
          {
            "$ref": "#/defs/adr-reference"
          }
        ]
      },
      "description": "References to ADRs (Architecture Decision Records) or similar documents that provide context or decisions related to the architecture. Each entry is either a plain link (URL or internal reference, retained for backward compatibility) or a structured adr-reference, which can declare the Solution Design Document the decision is part of."
    },
    "sdds": {
      "type": "array",
      "items": {
        "$ref": "#/defs/sdd-reference"
      },
      "description": "References to Solution Design Documents (SDDs) that describe this architecture. An SDD is the snapshot view of a solution; ADRs referencing it via part-of form its decision log."
    },
    "additionalProperties": false
  },
  "defs": {
    "adr-reference": {
      "type": "object",
      "description": "A structured reference to an Architecture Decision Record. When the decision belongs to a Solution Design Document's decision log, part-of names that SDD by its unique-id in this document's sdds array.",
      "properties": {
        "unique-id": {
          "type": "string",
          "description": "Stable identifier of the decision within its governance scope, e.g. GOV-ADR-001 for solution scope or ADR-007 for repository-local software scope."
        },
        "ref": {
          "type": "string",
          "description": "Link to the decision record: a URL or an internal documentation reference."
        },
        "status": {
          "enum": [
            "proposed",
            "accepted",
            "superseded",
            "rejected"
          ],
          "description": "Lifecycle status of the decision at the time this architecture document was produced."
        },
        "scope": {
          "enum": [
            "enterprise",
            "solution",
            "software"
          ],
          "description": "Governance scope of the decision in a federated decision hierarchy."
        },
        "part-of": {
          "type": "string",
          "description": "unique-id of the Solution Design Document (in this document's sdds array) whose decision log this ADR belongs to."
        },
        "supersedes": {
          "type": "array",
          "items": {
            "type": "string"
          },
          "description": "unique-ids of decisions this record supersedes."
        }
      },
      "required": [
        "ref"
      ],
      "additionalProperties": false
    },
    "sdd-reference": {
      "type": "object",
      "description": "A reference to a Solution Design Document: the human-readable snapshot of a solution's structure, of which this CALM document may be the machine-readable counterpart.",
      "properties": {
        "unique-id": {
          "type": "string",
          "description": "Stable identifier of the SDD, e.g. GOV-SDD."
        },
        "ref": {
          "type": "string",
          "description": "Link to the SDD: a URL or an internal documentation reference."
        },
        "title": {
          "type": "string"
        },
        "status": {
          "enum": [
            "draft",
            "in-review",
            "approved",
            "retired"
          ],
          "description": "Lifecycle status of the SDD at the time this architecture document was produced."
        }
      },
      "required": [
        "unique-id",
        "ref"
      ],
      "additionalProperties": false
    },
    "node": {
      "type": "object",
      "properties": {
        "unique-id": {
          "type": "string"
        },
        "node-type": {
          "$ref": "#/defs/node-type-definition"
        },
        "name": {
          "type": "string"
        },
        "description": {
          "type": "string"
        },
        "details": {
          "type": "object",
          "properties": {
            "detailed-architecture": {
              "type": "string"
            },
            "required-pattern": {
              "type": "string"
            }
          },
          "additionalProperties": false
        },
        "interfaces": {
          "type": "array",
          "items": {
            "anyOf": [
              {
                "$ref": "interface.json#/defs/interface-definition"
              },
              {
                "$ref": "interface.json#/defs/interface-type"
              }
            ]
          }
        },
        "controls": {
          "$ref": "control.json#/defs/controls"
        },
        "metadata": {
          "$ref": "#/defs/metadata"
        }
      },
      "required": [
        "unique-id",
        "node-type",
        "name",
        "description"
      ],
      "additionalProperties": true
    },
    "relationship": {
      "type": "object",
      "properties": {
        "unique-id": {
          "type": "string"
        },
        "description": {
          "type": "string"
        },
        "relationship-type": {
          "type": "object",
          "properties": {
            "interacts": {
              "$ref": "#/defs/interacts-type"
            },
            "connects": {
              "$ref": "#/defs/connects-type"
            },
            "deployed-in": {
              "$ref": "#/defs/deployed-in-type"
            },
            "composed-of": {
              "$ref": "#/defs/composed-of-type"
            },
            "options": {
              "$ref": "#/defs/option-type"
            }
          },
          "oneOf": [
            {
              "required": [
                "deployed-in"
              ]
            },
            {
              "required": [
                "composed-of"
              ]
            },
            {
              "required": [
                "interacts"
              ]
            },
            {
              "required": [
                "connects"
              ]
            },
            {
              "required": [
                "options"
              ]
            }
          ]
        },
        "protocol": {
          "$ref": "#/defs/protocol"
        },
        "metadata": {
          "$ref": "#/defs/metadata"
        },
        "controls": {
          "$ref": "control.json#/defs/controls"
        }
      },
      "required": [
        "unique-id",
        "relationship-type"
      ],
      "additionalProperties": true
    },
    "protocol": {
      "enum": [
        "HTTP",
        "HTTPS",
        "FTP",
        "SFTP",
        "JDBC",
        "WebSocket",
        "SocketIO",
        "LDAP",
        "AMQP",
        "TLS",
        "mTLS",
        "TCP"
      ]
    },
    "node-type-definition": {
      "anyOf": [
        {
          "enum": [
            "actor",
            "ecosystem",
            "system",
            "service",
            "database",
            "network",
            "ldap",
            "webclient",
            "data-asset"
          ]
        },
        {
          "type": "string"
        }
      ]
    },
    "interacts-type": {
      "type": "object",
      "properties": {
        "actor": {
          "type": "string"
        },
        "nodes": {
          "type": "array",
          "minItems": 1,
          "items": {
            "type": "string"
          }
        }
      },
      "required": [
        "actor",
        "nodes"
      ]
    },
    "connects-type": {
      "type": "object",
      "properties": {
        "source": {
          "$ref": "interface.json#/defs/node-interface"
        },
        "destination": {
          "$ref": "interface.json#/defs/node-interface"
        }
      },
      "required": [
        "source",
        "destination"
      ]
    },
    "deployed-in-type": {
      "type": "object",
      "properties": {
        "container": {
          "type": "string"
        },
        "nodes": {
          "type": "array",
          "minItems": 1,
          "items": {
            "type": "string"
          }
        }
      },
      "required": [
        "container",
        "nodes"
      ]
    },
    "composed-of-type": {
      "type": "object",
      "properties": {
        "container": {
          "type": "string"
        },
        "nodes": {
          "type": "array",
          "minItems": 1,
          "items": {
            "type": "string"
          }
        }
      },
      "required": [
        "container",
        "nodes"
      ]
    },
    "option-type": {
      "type": "array",
      "items": {
        "$ref": "#/defs/decision"
      }
    },
    "decision": {
      "type": "object",
      "properties": {
        "description": {
          "type": "string"
        },
        "nodes": {
          "type": "array",
          "items": {
            "type": "string"
          }
        },
        "relationships": {
          "type": "array",
          "items": {
            "type": "string"
          }
        },
        "controls": {
          "type": "array",
          "items": {
            "type": "string"
          }
        }
      },
      "required": [
        "description",
        "nodes",
        "relationships"
      ]
    },
    "metadata": {
      "oneOf": [
        {
          "type": "array",
          "items": {
            "type": "object"
          }
        },
        {
          "type": "object",
          "additionalProperties": true
        }
      ]
    }
  }
}